{
  "schemaVersion": 1,
  "jobId": "fixture-space-capsule-30",
  "sourceImage": {
    "fileName": "太空舱直径30.jpg",
    "sha256": "10d25212113b6ea7586ea7ac0646ee0b52d053e39f845f6db53a5e7c55a25c47",
    "widthPx": 800,
    "heightPx": 800
  },
  "productFamilyCandidates": [
    {
      "family": "wall-space-capsule-platform",
      "confidence": 0.97
    }
  ],
  "dimensionEvidence": [
    {
      "id": "overall-width-label",
      "kind": "overall-width",
      "label": "商品标注宽度",
      "valueMm": 400,
      "axis": "x",
      "imageRegion": [0.31, 0.23, 0.73, 0.34],
      "sourceText": "40cm",
      "confidence": 0.99,
      "status": "proposed",
      "notes": "箭头横跨产品上方，仍需用户确认它对应整体宽度还是背板宽度。"
    },
    {
      "id": "right-side-height-label",
      "kind": "overall-height",
      "label": "商品右侧标注高度",
      "valueMm": 200,
      "axis": "y",
      "imageRegion": [0.75, 0.35, 0.87, 0.65],
      "sourceText": "20cm",
      "confidence": 0.99,
      "status": "proposed",
      "notes": "箭头范围看起来只覆盖木质框架，是否包含透明舱体需要人工确认。"
    },
    {
      "id": "capsule-diameter-label",
      "kind": "diameter",
      "label": "太空舱直径",
      "valueMm": 300,
      "axis": "diameter",
      "imageRegion": [0.24, 0.51, 0.71, 0.61],
      "sourceText": "太空舱直径30cm",
      "confidence": 0.99,
      "status": "proposed"
    }
  ],
  "partCandidates": [
    {
      "id": "back-panel-candidate",
      "kind": "panel",
      "label": "墙面背板",
      "imagePolygon": [[0.33, 0.35], [0.72, 0.37], [0.72, 0.51], [0.33, 0.49]],
      "visible": true,
      "confidence": 0.93
    },
    {
      "id": "platform-candidate",
      "kind": "panel",
      "label": "水平承托板",
      "imagePolygon": [[0.2, 0.51], [0.69, 0.5], [0.7, 0.59], [0.19, 0.59]],
      "visible": true,
      "confidence": 0.94,
      "notes": "板件包含圆孔或沉台，深度与厚度未标注。"
    },
    {
      "id": "capsule-candidate",
      "kind": "hemisphere",
      "label": "透明太空舱",
      "visible": true,
      "confidence": 0.9
    },
    {
      "id": "left-support-candidate",
      "kind": "support",
      "label": "左侧支撑",
      "visible": true,
      "confidence": 0.76
    },
    {
      "id": "right-support-candidate",
      "kind": "support",
      "label": "右侧支撑",
      "visible": true,
      "confidence": 0.82
    }
  ],
  "ambiguities": [
    {
      "code": "OVERALL_DEPTH_MISSING",
      "message": "商品图没有标注组件前后方向的整体深度。",
      "severity": "blocking",
      "requiredResolution": "用户输入整体深度，并确认水平承托板的前后尺寸。"
    },
    {
      "code": "HEIGHT_SCOPE_AMBIGUOUS",
      "message": "20 cm 标注的起止范围是否包含透明舱体不明确。",
      "severity": "blocking",
      "requiredResolution": "用户确认 20 cm 对应木质框架高度还是完整组件高度。"
    },
    {
      "code": "BOARD_DIMENSIONS_INCOMPLETE",
      "message": "背板、承托板和支撑板件的独立尺寸不完整。",
      "severity": "blocking",
      "requiredResolution": "用户逐块确认板件的长、宽；板厚可选择产品族默认值。"
    },
    {
      "code": "BOARD_THICKNESS_MISSING",
      "message": "木质板件厚度没有标注。",
      "severity": "warning",
      "requiredResolution": "用户确认板厚，或明确批准使用模板默认值。"
    },
    {
      "code": "MOUNTING_HOLES_MISSING",
      "message": "图片中没有可确认的墙面安装孔径和孔位。",
      "severity": "blocking",
      "requiredResolution": "用户标注每个施工孔的所属板件、孔径、中心位置和轴向。"
    }
  ]
}
